{
  "qualification_mode": true,
  "release_digest": "sha256:qualified",
  "active_requests": 0,
  "page_references": 0,
  "snapshot_references": 0,
  "leases": 0,
  "transfer_buffers": 0,
  "model_bytes": 100,
  "kv_bytes": 20,
  "compressed_page_bytes": 10,
  "allocator_reserved_bytes": 140,
  "observed_vram_bytes": 140,
  "cuda_errors": 0,
  "correctness_failures": 0,
  "cross_tenant_violations": 0,
  "dense_fallback_launches": 1,
  "audit_chain_verified": false,
  "mtls_verified": false,
  "telemetry_correlated": false,
  "workers": []
}
